Date Time,Sentiment,Text,User Name,Retweets,Favorites
26-9-17,1, اعلان وظائف مصريه اتصالات نحن رابط وطريقه تقديم وظائف شركه رابعه,,0,0
26-9-17,1, كبرت واد وهتبقي جد وبدل ايد راح تسندك يد اصل اللي منك اللي باقين تويته حب اعلان شبكه مصريه اتصالات,,2,4
26-9-17,1, اعلان مصريه اتصالات,,0,0
26-9-17,1, تسمع وتتفرج اعلان مصريه جديد تحس عاوز جري شريط مبقتش حاجه تاثر نظام مصريه اتصالات بتوع زمان,,0,0
26-9-17,1, اعلان شركه جديده مصريه اتصالات,,0,0
26-9-17,-1, اسمع بس اغنيه اعلان مصريه اتصالات انت هتفك,,1,1
26-9-17,1, اعلان شبكه جديده مصريه اتصالات,,0,0
26-9-17,1, اسياده موساد بيتمنو وزيرا اتصالات مصريه,,0,0
26-9-17,-1, يلعن ابو نت تي داتا مصريه اتصالات مصر الي يتشددلهم,,1,3
26-9-17,-1, قعدت مصريه اتصالات مستنيه دوري وقدامي اوراق دعايه بتاعتهم عملتها كلها مراكب لحد ماجه دوري,,0,7
26-9-17,1, بحب اعلان مصريه اتصالات جدا بحب اتفرج كدراته متاخده وطريقه تصويرها ومونتاجه بفرح اما بلاقيه تلفزيون,,1,1
26-9-17,1, ماهي تبع مصريه اتصالات,,0,0
26-9-17,1, ضاه سبحان الله كلمتهم ردوا مصريه اتصالات,,0,1
26-9-17,1, مصريه اتصالات حاجات جميله بجد,,0,0
26-9-17,1, متخيل ناس ال اللي عاجبهم اعلان مصريه اتصالات وبيفصصوا جمال اغنيه و واللي قشعر واللي عيط بصراحه انتو,,0,1
26-9-17,1, مصريه اتصالات,,0,0
26-9-17,-1, اتصالات مصر شاء الله هيتم تحويل خط لشبكه مصريه اتصالات بسبب سوء خدمه اللي بقت زفت فتره اخيره وشكرا,,0,0
26-9-17,1, رئيس قطاع مؤسسي ب اتصالات مصر شبكتنا قادره استيعاب عملاء مصريه اتصالات تاثير جوده خدمه,,0,0
26-9-17,1, شكرا فندم اتمني الكل يشتري خط مصريه اتصالات تكونوا دايما قمه عروض تستمر ناس بتحب عروض اعلانات كتير,,0,0
26-9-17,1, هتوصي منك اللي منك منك ولا عاجباني قوي جمله اعلان مصريه اتصالات و,,0,0
26-9-17,-1, احوال مصر حول خطك مصريه اتصالات خطوات,,1,0
26-9-17,1, اعلان مصريه اتصالات مثلا,,0,1
26-9-17,1, اعلان مصريه اتصالات جديد شويه تعيش بيهم اسبوع جئ,,0,0
26-9-17,1, مفروض بتاعت مصريه اتصالات,,0,0
25-9-17,-1, خدمه مصريه اتصالات سيئه جدا نت تليفونات ارضيه مقطوعه عجمي اكلم خدمه عملاء تي داتا اقي,,0,0
25-9-17,1, اصل اللي منك اللي باقينلك اللي عارفينك زمان عايشين يومك عارفين همومك عايشين سوا نفس حياه اعلان مصريه اتصالات,,0,6
25-9-17,1, اغنيه اعلان مصريه اتصالات,,0,3
25-9-17,1, اللي منك اللي باقيين اللي عايشين نفس حياه مصريه اتصالات تدعم اهل مصر,,0,0
25-9-17,1, متخيله شخص عاقل ليه تجربه تي داتا يروح برجله يشترك شركه موبايل جديده بتاعه مصريه اتصالات,,0,0
25-9-17,1, اعلان مصريه اتصالات روعه اقسم بالله,,0,0
25-9-17,1, مبسوطين عدد وواحد عمال يصور هينزل صور صفحه مصريه اتصالات غالبا,,0,0
25-9-17,1, اعلان مصريه اتصالات حلو جدا يارب كمان خدمه بنفس فكره اعلان,,1,0
25-9-17,1, اغنيه مصريه اتصالات دي جميله فشخبجد ميتزهقش,,1,1
25-9-17,1, دفاع عندي جابلي رقم مصريه اتصالات,,3,10
25-9-17,1, فاتوره تلفون ارضي لشهر يوليو وطرق سداد شركه مصريه اتصالات وعبر,,0,0
25-9-17,1, اعلان مصريه اتصالات جديد مرات يبدعوا اعلانات,,0,1
25-9-17,1, سرعه تعتمد جوده خط ارضي مصريه اتصالات اخيرا ظبطوا نت عندي,,0,0
25-9-17,1, بحب جدا اعلان مصريه اتصالات دا,,1,6
25-9-17,-1, بلا ڤودافون بلا خرا مصريه اتصالات حته سكره,,0,2
25-9-17,1, اعجبني فيديو اعلان مصريه اتصالات جديد,,0,0
25-9-17,1, متخيل شخص عاقل ناضج ليه تجربه تي داتا يروح برجله يشترك شركه محمول بتاعه مصريه اتصالات,,0,4
25-9-17,1, جماعه اغنيه اعلان مصريه اتصالات حلوه جدًا بجد عايزه انزلها والله,,6,16
25-9-17,1, اغنيه مصريه اتصالات حلوه اوي جماعه اوي,,4,8
25-9-17,1, اعلان مصريه اتصالات حقيقي مبهج جدا شابو لصاحب فكره مصريه اتصالات,,1,0
25-9-17,-1, ڤودافون قوه ايديك اورانچ ناس اتصالات دلوقتي وقتها مصريه اتصالات هات حاجه عشان اروح نبي,,0,0
25-9-17,1, اقبال شديد شركه مصريه اتصالات بكفر شيخ,,0,1
25-9-17,1, شركه مصريه اتصالات تشغيل شبكه رابعه هتخرج حصتها فودفون ال بتجيب ايرادات ارباح مصريه,,0,0
25-9-17,1, احلا اغاني اللي سمعتها حياتي اغنيه مصريه اتصالات دي,,22,4
25-9-17,1, خدمات موبايلكيفيه تحويل رصيد مصريه اتصالات مصريه اتصالات,,0,0
25-9-17,1, اعلان مصريه اتصالات حلو جدا يعني,,2,6
25-9-17,1, اعلان مصريه اتصالات ٢٠١٧ اُغنيه شبكه,,0,2
25-9-17,1, اغنيه اعلان مصريه اتصالات جديد جميله جدا,,0,3
25-9-17,-1, فودافون قوه ايديك اورانج ناس اتصالات دلوقتي وقتها مصريه اتصالات هات اس حاجه اروح نبي,,0,1
25-9-17,1, اغنيه شبكه وي مصريه اتصالات حاجه جميله جدا مبهجه كدا بتولد بوزتيڤ انيرجي فظيعه,,1,1
25-9-17,1, تجربتي شبكه مصريه اتصالات,,0,0
25-9-17,-1, اماكن بيع خطوط مصر اسعار خطوط جديده مصريه اتصالات اماكن توزيع خطوط تليكوم,,0,0
25-9-17,1, اغنيه بتاع مصريه اتصالات فشيخه,,0,3
25-9-17,-1, مصاري تطلق خدمات شحن خاصه بشبكه مصريه اتصالات كتبتشيماء شلبي قال محمد ناجي رئيس تنفيذي لشركه,,0,0
25-9-17,1, جدعان نصيحه لاي هيجيب خط مصريه اتصالات بص انت هتتناك حرفيا,,0,0
25-9-17,-1, لو سمحت فندم لسه مشترك خط مصريه اتصالات وفي مشكله شبكه شيل شريحه وحطها تاني فندم,,0,0
25-9-17,1, اعلان مصريه اتصالات حلو فششخ صباح خير,,3,1
25-9-17,1, تحرير اخره حلال حكومه موظف ب مصريه اتصالات كشف اختلاسات رؤسائه ففصلوه,,10,14
25-9-17,1, خطوط مصريه اتصالات جديده بتتباع فين,,0,0
25-9-17,1, اعلان مصريه اتصالات حاجه محترمه ونضيفه جداا والله,,0,1
25-9-17,1, فرق اتصالات مصر وبين مصريه اتصالات دي شركه ودي شركه,,0,0
25-9-17,1, طريقه تقديم لوظائف شركه مصريه اتصالات احنا منك شبكه محمول رابعه اعلنتالشركه مصريه,,0,0
25-9-17,1, سؤال ل اللي يخليني متمسك بيكم ومشتريش خط مصريه اتصالات ظل عروضهم نت مغريه جداا اكتر,,0,0
25-9-17,1, اعلان مصريه اتصالات دا حلو,,0,0
25-9-17,-1, اكتر ١٠٠شخص راحوا يقدموا شغل مصريه اتصالات اسف بسبب شخص معندوش ضمير عمل بوست وهمي وظائف موجوده عشان يلم لايكات شير,,0,0
25-9-17,1, تجربه حلوه ل تروح تعد جوا سنترال مصريه اتصالات تفكر جمل تشرح بيها ال بتاعتها,,0,1
25-9-17,1, خط مصريه اتصالات جديد اخيرا عاملوا حاجه سريعه,,0,0
25-9-17,-1, خبر مصريه اتصالات اشاعه عشان محدش يتبهدل اونطه وال ال عيب عليها تبهدل ناس عشان شويه لايكات وشير,,0,0
25-9-17,1, والله لشتري شريحه مصريه اتصالات عشان خاطر اعلان بتعهم,,0,3
25-9-17,-1, ولسه شبكه مصريه اتصالات تنتشر هيخلوها شبكه وحيده سينا ويقطعوها بسبب ومن سبب براحتهم,,0,0
25-9-17,1, مصريه اتصالات,,0,0
25-9-17,1, اغنيه اعلان مصريه اتصالات جمال اقسم بالله,,0,2
25-9-17,1, اشياء معرفتها شراء خط جديد مصريه اتصالات شبك,,0,0
25-9-17,1, اعلان اغنيه مصريه اتصالات اول مشغل اتصالات متكامل,,0,0
25-9-17,1, دا جزء بسيط محادثات بيني وبين مصريه اتصالات وتابعتها تي اي داتا ردودهم اكلاشيهات محفوظه ولا يوجد اي,,0,0
25-9-17,1, شبكه رابعه محمول اسعار باقات وموعد انطلاق رسميا وكيف تحول خطك لشبكه محمول مصريه اتصالات جديده شب,,0,1
25-9-17,1, مصريه اتصالات استمروا نفس بدايه وهتبقوا رقم واحد مصر اسعار جميله وتغطيه شبكه ممتازه انترنت سريع,,0,0
25-9-17,1, مصريه اتصالات اول مشغل اتصالات متكامل,,0,0
25-9-17,1, مصريه اتصالات عامله خط جديد باقته رخيصه فشخ,,0,0
25-9-17,-1, مصريه اتصالات وتي اي داتا مستحيل معاها نعمل داونلوود انترنت يقطع ونبدا اول وتقريبا بحاول انزله اسبوع وفشلت,,0,0
25-9-17,1, تريد معرفته خط محمول مصريه اتصالات جديد,,0,0
25-9-17,1, شيكه جديده مصريه اتصالات,,0,0
25-9-17,-1, جماعه ياريت اللي هيجيب خط مصريه اتصالات يعمل حسابي خط مفيهاش اساءه ادب,,0,1
25-9-17,1, اغنيه منك اعلان مصريه اتصالات,,0,4
25-9-17,1, اللي حيسندو بدل يد مئه الف يد اغنيه يعم بتاعه مصريه اتصالات حلو مقطع هجه صعيدي,,0,0
25-9-17,1, موقع بوابه فيتو فيتو خطوات لتحويل خطوط مصريه اتصالات عبر نبض,,0,0
25-9-17,1, اطلقت شركه مصريه اتصالات امس اثنين خدماتها متكامله شبكه جديده محمول ثابت انترنت وقال,,0,0
25-9-17,1, مصريه اتصالات وخدمات شبكه رابعه محمول سبتمبر وحلم مصريين اصبح حقيقه الان,,0,0
25-9-17,1, اول مره اشوف اعلان مصريه اتصالات وقتي وفهمت انتو كنتوا بتهروا حمد لله,,0,1
25-9-17,1, عايده ايوبي اعلان مصريه اتصالات ادينا ايدك,,0,0
25-9-17,-1, مصريه اتصالات اصلا بتمتلك بقالها اكتر ٨ سنين بس عاملين انهم منفصلين اكتر,,0,0
25-9-17,1, اعلان مصريه اتصالات,,0,4
25-9-17,1, اغنيه اعلان بتاع مصريه اتصالات حلوه اوي,,2,2
25-9-17,1, وظائف خاليه فتح باب تعينات شبكه خط رابع محمول مصريه اتصالات برواتب تصل جنيه تقديم علي,,0,0
25-9-17,1, اعلان مصريه اتصالات جميل جدا حاجه خيال,,0,0
25-9-17,-1, عرض الل حنواجه بيه مصريه اتصالات وعروضها تقريبا,,0,0
25-9-17,1, هتوصي منك اللي منك بحب اغنيه اعلان مصريه اتصالات,,0,2
25-9-17,1, اعلان مصريه اتصالات ٢٠١٧ اُغنيه شبكه,,0,0
24-9-17,1, اعلان مصريه اتصالات دا مبهج جدا والله,,1,2
24-9-17,-1, اعلان مصريه اتصالات جمييل لاقصي درجه وربنا حاجه شغل عاالي جدا,,0,1
24-9-17,1, بحب اعلان مصريه اتصالات,,1,6
24-9-17,1, اعلان مصريه اتصالات جديد حلو اوي,,0,0
24-9-17,1, هتوصي منك اللي منك ولا مصريه اتصالات,,1,1
24-9-17,1, ابقي افتكرنا امير قلوب بخط مصريه اتصالات,,0,0
24-9-17,-1, مصريه اتصالات عاوز اشترك نظام تلفونت شابهفي جيل رابع ومعنديش خط ارضي اعمل ايه لو ينفع دليفري,,0,0
24-9-17,1, مصريه اتصالات اول مشغل اتصالات متكامل,,0,1
24-9-17,1, شعب عندنا عقده خواجه لوجو بتاع مصريه اتصالات حلو جدا لون جدا شعار ممتاز بس شعب مريض نفسي وشكرا,,0,1
24-9-17,1, بس اغنيه مصريه اتصالات حلوه تفاؤل بس ملناش دعوه كلام طبعا,,0,0
24-9-17,1, ايجيبت تو زيرو مصريه اتصالات,,0,0
24-9-17,1, مابعد ليل جميله انت كاعلان مصريه اتصالات,,2,0
24-9-17,1, اغنيه مصريه اتصالات بتاع شبكه حلوه جدا والله,,1,9
24-9-17,1, اعلان مصريه اتصالات فشيخ الله,,0,1
24-9-17,1, حلو اوي اعلان مصريه اتصالات ومبهج اوي,,1,3
24-9-17,1, اغنيه مصريه اتصالات دي حلوه فشخ,,0,3
24-9-17,1, اصل اللي منك اللي باقين اللي عارفينك زمان عايشين يومك عارفين همومك عايشين سوا نفس حياه اعلان مصريه اتصالات,,0,0
24-9-17,1, انتو بتقولو اصل منك عرفينك زمان عارفين اني مستلف شبكات دور عليكو بقا سلفني شكرا مصريه اتصالات,,1,2
24-9-17,-1, اعتقد صعب وهما هيدوا حبيبنا حته تورته طريق مصريه اتصالات لحد تتشهر وتلغي باقي شبكات عشان يراقبونا براحتهم,,0,1
24-9-17,1, مصريه اتصالات اعلان حلو,,0,11
24-9-17,-1, مصريه اتصالات بتدفع ملايين واحده اسوا حملات ماركتينج اللي شفتها مصر لحد دلوقتي بنسبه كبيره شغل,,0,0
24-9-17,-1, يبني شبكه هتشتغل بيه شبكه مصريه اتصالات,,0,0
24-9-17,-1, ماكينات فوري قيها شحن رصيد مصريه ونفس ماكينه مافيهاش شخن مصريه اتصالات,,0,0
24-9-17,1, اعلان مصريه اتصالات جديد شبكه رابعه,,0,0
24-9-17,-1, كلمات اغنيه واماكن تصوير بتاع اعلان مصريه اتصالات حتي اشخاص حاجه كدا عظيمه,,0,3
24-9-17,1, اعلان مصريه اتصالات عظيم جدا بصراحه جميل,,0,0
24-9-17,1, الان كروت شبكه مصريه اتصالات فوري,,0,0
24-9-17,1, انا صلاه نبي كدا شاكب راكب طالع نازل عاوز جيجا نت دقيقه شبكات والا هحول مصريه اتصالات,,4,4
24-9-17,-1, مصريه اتصالات نزلوا اعلانات ونزلوا باقات مكالمات ونزلوا باقات نت ونزلوا رقم خدمه عملاء بس نسوا ينزلوا خطوط,,0,0
24-9-17,1, مصريه اتصالات,,0,0
24-9-17,1, نظام محاسبه هيكون وحده واحده دقائق مصريه اتصالات رسائل ميجابايتس وحدات دقائق لاي شبكه اخري خط ارضي,,0,0
24-9-17,1, فيتو خطوات لتحويل خطوط مصريه اتصالات,,0,1
24-9-17,1, شركه سيتكس اتصالات تطلب فنيين صعود ابراج ومهندسين مدني عمل بمشروع فودافون مشروع مصريه اتصالات,,0,0
24-9-17,1, تشرفنا انضمام لينا تحول بنفس رقمك حالي مجانا وتنضم لشبكه مصريه اتصالات عشان يتم لازم,,0,1
24-9-17,-1, واحنا امتي بنسال اسئله دي اداره نفس طريقه اداره مصريه اتصالات,,1,0
24-9-17,1, مصريه اتصالات اول مشغل اتصالات متكامل,,0,0
24-9-17,1, اكواد شبكه مصريه اتصالات استعلام تحويل واسعار باقات انترنت وكود اشتراك خمس خطوات,,0,0
24-9-17,1, صور قافله طبيه موجهه خامسه اعبي اولمبياد خاص رعايه مصريه اتصالات رعايه شركه,,0,0
24-9-17,1, ملخص ال بتاع مصريه اتصالات مصريين ومنك وانت مصري ومننا فا يعني بلاها كواليتي بلاها بيزنيس يو,,1,0
24-9-17,1, عايز اشتري ٥ خطوط سيريال مميزين شركه جديده مصريه اتصالات حبايبنا يقدر يخدمني,,0,0
24-9-17,-1, اطلاق جيل رابع خميس انا شركات ال ٣ ارفع دعوي احتكار مصريه اتصالات واضح تاخير وي تبدا به مصر سفوخس,,3,0
24-9-17,1, اعلان مصريه اتصالات حلو اوي بيحسسك حياه لطيفه جدا بتاع معانها زفت يعني,,0,1
24-9-17,-1, خط مصريه اتصالات جديد نزل ولا لسه اعلانات بس وكدا,,0,0
24-9-17,1, حوار شركه مصريه اتصالات انها حكوميه وعملت ميديا دي كلها زحمه ريت اللي ابتدت بيه اسعار اللي نازله بيه يعتبر انجاز حكومه,,0,1
24-9-17,1, جاب خط مصريه اتصالات ده,,1,0
24-9-17,1, عاجبني اعلان مصريه اتصالات دا,,0,0
24-9-17,1, خلينا متفقين مصريه اتصالات منزله عروض حلوه جداا وبفكر احول خطي ليها اما بقي يا تعملي,,1,2
24-9-17,-1, سخريه لوجو شركه محمول رابعه مصريه اتصالات,,0,0
24-9-17,-1, انتوا ابعد حدعن عميل شركه ربحيه بس مبتهتمش برضاء عملائها مصريه اتصالات افشل دعم فني وخدمه عملاء,,0,0
24-9-17,1, هتلاقيه فرع مصريه اتصالات رئيسي,,0,1
24-9-17,1, ڤودافون معاها ٥١ عشان حق اداره بس اصلا مصريه اتصالات نازلين اول ڤودافون عشان ماعندهمش ابراج لسه,,1,0
24-9-17,1, قريبا جاري تجربه خط جديد مصريه اتصالات,,0,0
24-9-17,1, عرفت نهارده مصريه اتصالات عندها فودافون,,3,5
24-9-17,1, وظائف شبكه جديده وكيفيه تقديم ليها مصريه اتصالات عبر,,0,0
24-9-17,1, شعارات تصميم لوجو مصريه اتصالات,,0,3
24-9-17,1, مصريه ل تصا ت,,0,0
24-9-17,1, شاكب راكب كدا عايز جيجا نت دقيقه مجانيه شبكات والا هحول مصريه اتصالات,,0,1
24-9-17,1, لتفعيل خط مصريه اتصالات رجاء دخول مصريه اتصالات,,0,0
24-9-17,-1, قاعد سنترال بشتري خط مصريه اتصالات دور دلوقت رقم وانا رقمي وعندي مشوار ساعه ٣ شكلي,,0,0
24-9-17,1, ناس اللي عماله تحط شبكات تلاته قدام احب اقولكم اهدوا كدهون واشربوا ليمون مصريه اتصالات بتاعت,,0,0
24-9-17,1, جاب خط مصريه اتصالات جديد,,0,0
24-9-17,1, قررت اجيب خط مصريه اتصالات مديش رقمي جديد,,0,0
24-9-17,-1, نت مصريه اتصالات خره,,0,1
24-9-17,1, جدعان اعلان مصريه اتصالات حلو بجد ولا شايف غلط,,0,0
24-9-17,1, اعلان مصريه اتصالات,,0,0
24-9-17,1, اعلان مصريه اتصالات دا حلو جدا,,0,2
24-9-17,1, اقبال تاريخي مصريه اتصالات,,0,1
24-9-17,-1, ننشر قائمه فروع مصريه اتصالات لتقديم خدمات بيع خطوط محمول,,0,0
24-9-17,1, فودافون ال ينتظر اشاره قومي اتصالات ومفاوضاتنا مصريه مستمره ميزان اقتصادي,,0,0
24-9-17,1, مصريه اتصالات تستهدف جذب مليوني عميل محمول شهريا اطلقت شركه مصريه اتصالات شبكتها رابعه محمول,,0,0
24-9-17,1, تصميم مصريه اتصالات اشبه بعلامه باين,,0,1
24-9-17,1, اعلان مصريه اتصالات,,0,0
24-9-17,1, تريد معرفته خط محمول مصريه اتصالات جديد,,0,0
24-9-17,1, وظائف مصريه اتصالات اطلاق شبكه وطريقه تقديم شركه,,0,0
24-9-17,1, اغنيه اللي اعلان مصريه اتصالات جديد عظيمه والله,,0,0
24-9-17,1, اعلان مصريه اتصالات ٢٠١٧ اُغنيه شبكه,,0,1
24-9-17,1, هحول شبكه رابعه مصريه اتصالات ماشلتوش ال جنيه اللي عليا خدمه سلفني شكرا,,1,1
24-9-17,1, مصريه اتصالات وخدمات شبكه رابعه محمول سبتمبر حلم اصبح حقيقه واقبال هائل شراء خطوط جديده,,0,0
24-9-17,1, اعلان مصريه اتصالات ٢٠١٧ اُغنيه شبكه,,0,1
24-9-17,1, مصريه اتصالات اول مشغل اتصالات متكامل,,0,0
24-9-17,-1, خط مصريه اتصالات هديه ليا والله بدري عايزه اغير خط بتاعي بس مكسله اهي جات ربنا,,0,0
24-9-17,-1, شركه مصريه اتصالات بس هتلاقيه زحمه,,0,2
24-9-17,1, تعلم شبكه رابعه مصريه اتصالات شركه مصريه,,0,0
24-9-17,1, فرق اعلان مصريه اتصالات واعلان كريم سما ارض,,0,0
24-9-17,1, مقارنه نظام خط مصريه اتصالات ثلاث شركات اخري,,19,14
24-9-17,1, شركه مصريه اتصالات استفسار حضرتكم ضروري,,0,0
24-9-17,1, مصريه اتصالات ب شير,,0,1
24-9-17,1, اغسطس نمت ارباح مصريه اتصالات ربع ثاني عام حالي بنسبه مقارنه ربع ثاني عام ماضي لتسجل مليار جنيه,,0,0
24-9-17,-1, ريت موظفين مصريه اتصالات يشوفوا شغلهم بدل ماشيين يطبلوا ويعرصوا شركه فيسبوك,,0,0
24-9-17,1, طب متعرفش بيتباع سنترال بتاع مصريه اتصالات ولا,,0,0
24-9-17,-1, بيان مصريه اتصالات بشان خسائر حريق ورش مركزيه قاهره تابعنا الان,,0,0
24-9-17,1, اعلان مصريه اتصالات حلاوه بجد,,3,25
24-9-17,1, دخول مفاجئ بحب اعلان مصريه اتصالات جديد,,0,0
24-9-17,1, خطوط بتاعت مصريه اتصالات نزلت ولا لسه,,1,0
24-9-17,1, انا صلاه نبي كدا شاكب راكب طالع نازل عاوز جيجا نت دقيقه شبكات والا هحول مصريه اتصالات,,67,9
23-9-17,1, اشتري خط مصريه اتصالات,,0,0
23-9-17,1, نقاش اشتري خط مصريه اتصالات وجربه مكالمات نت كويس ولا كلام,,0,0
23-9-17,1, اعلان مصريه اتصالات ٢٠١٧ اُغنيه شبكه,,0,1
23-9-17,-1, بحيري ل محور مصريه اتصالات تنافس شركات محمول ذي,,0,0
23-9-17,-1, مصر فايف مصريه اتصالات شبكه اسعار باقات انترنت شبكه جيل رابع ومقارنه شركات محمول اربعه,,0,0
23-9-17,1, عاجبني اوي اغنيه اعلان مصريه اتصالات شبه اعلانات موبينيل زمان,,0,0
23-9-17,1, تنويه شركه مصريه اتصالات عدم وجود اي وظائف وفرص عمل شركه,,0,0
23-9-17,1, اعلان مصريه اتصالات عظيم تصوير اغنيه برضو,,1,1
23-9-17,1, اعلان مصريه اتصالات حاجه مبهجه بجد,,0,4
23-9-17,-1, ال شايف ناس كلها عماله تكلم خطوط مصريه اتصالات ومحد فيكو جربو وقال نظام شبكه وكلو ولا حته رن عليا منو,,0,0
23-9-17,1, وي معا لدعم بلدنا كنت قد اشرت منشور سابق لعمل شركه مصريه اتصالات شبكه,,0,0
23-9-17,-1, صرحت شركه مصريه اتصالات بانها قامت بافتتاح ثلاثاء ماضي اول مراكز خدمه عملاء تعمل علي,,0,0
23-9-17,1, وظائف مصريه اتصالات اطلاق شبكه وطريقه تقديم,,0,0
23-9-17,1, اعلان مصريه اتصالات جديد حلو خالص,,6,7
23-9-17,-1, انا شايف اعلان خط مصريه اتصالات ضعيف مقارنه شركات تانيه اعلانات اللي عملوها مجتمع وفئات,,0,0
