Date Time,Sentiment,Text,User Name,Retweets,Favorites
25-5-17,-1, ملعون ابو شركه نت اورنج مصريه اتصالات بلد بنت كلب زباله,,0,0
25-5-17,1, ساده زملاء عاملين شركه مصريه اتصالات حصول ميزه نت اطلب رقم ساعه وسوف يقوم,,0,0
24-5-17,1, بقالي اسبوع بجري ورا فنين بتوع مصريه اتصالات محدش بيجي اول اما قلت لواحد تعالي وهراضيك ربع ساعه تلفون اشتغل تحيا مسر ٣ مرات,,0,1
24-5-17,1, شركه مصريه اتصالات,,0,0
24-5-17,1, اظن والله اعلم فودافون مصر بتنضرب جوا تمهيدا لنزول مصريه اتصالات لسوق خدمات محمول,,0,0
24-5-17,-1, مصريه اتصالات قرار لجنه قيد اسم شركه مصريه اتصالات كود ترقيم دولي,,0,0
24-5-17,-1, عارف انت تتزنق مابين شركه مصريه اتصالات وشركه بيضه وتفضل بقي لفي بينا دنيا مرجحينا يادنيا حاجه زباله,,0,1
24-5-17,1, شركه مصريه اتصالات,,0,0
23-5-17,1, طالبات تخصص الكترونيات تدريب لحام الياف ضوئيه شركه مصريه اتصالات ودائما امام,,0,0
23-5-17,1, فاعليات تدريب طالبات مدرسه باب شعريه صناعيه بنات لتخصص الكترونيات شركه مصريه اتصالات وتدريبهم علي,,0,0
23-5-17,1, اسرائيليه اتصالات مصريه اتصالات,,0,0
23-5-17,-1, اوسخ شركه مصر مصريه اتصالات,,0,0
23-5-17,1, حسبي الله نعم وكيل مصريه اتصالات,,0,0
22-5-17,-1, سحر جبر ابنه مصريه اتصالات سافرت صين اعداد قاده واعشق ترجمه,,0,0
22-5-17,-1, توتير وحشني والله الله يخربيت مصريه اتصالات,,0,0
22-5-17,1, نواقل دوليه مساهم اكبر ارباح مصريه اتصالات بسبب تعويم,,0,0
22-5-17,1, فعل عرض عمل زياره فنيه جهتنا معا جانب مصريه اتصالات لفحص كابينه وتم رفضها جهتك,,0,0
22-5-17,1, شمس اسكان ترفض عرضا مصريه اتصالات,,0,0
22-5-17,1, نواقل دوليه مساهم اكبر ارباح مصريه اتصالات بسبب تعويم مصر اقتصاد,,0,0
22-5-17,-1, يومي بقي خناق شركه نت خناق ال بتاع ال با خناق مصريه اتصالات,,0,0
22-5-17,1, نتنياهو حيعينك رئيس مجلس اداره مصريه اتصالات هدف اسمي تبقي رئيس مصر ابقي رئيس شركه,,0,0
22-5-17,1, توقعات بوصول مصريه اتصالات لاتفاق بشان خطه تجوال محلي,,0,0
22-5-17,1, مليار جنيه مصري ايرادات شركه مصريه اتصالات ربع اول تكنولوجيا واخبارها,,0,0
21-5-17,1, اعلان شركه مصريه اتصالات منشور,,0,0
21-5-17,-1, شركات مصريه اتصالات توقع اتفاقا حصول رخصه جيل رابع محمول,,0,0
21-5-17,1, عالم اليوم بنوك اهلي كويتي و اتحاد وطني تشارك بقرض مصريه اتصالات,,0,0
21-5-17,1, فودافون مناقشات تجوال محلي مصريه اتصالات مازالت مستمره جريده بورصه,,1,0
21-5-17,1, هولدينج ميلعبش مصريه اتصالات,,0,0
21-5-17,1, مليار جنيه مصري ايرادات شركه مصريه اتصالات ربع اول تكنولوجيا واخبارها,,0,0
21-5-17,1, اطار تحول مصريه اتصالات مشغل اتصالات متكامل تعديل ترقيم خطوط ارضيه محافظه دقهليه ليبدا,,0,0
21-5-17,1, تدريب مصريه اتصالات مميزات تدريب زياره ميدانيه لل خاص شركه,,0,0
21-5-17,1, تغطيه جمهوريه قريب ياخبر انتهت شركه مصريه اتصالات عمليات احلال كابلات الياف,,0,0
21-5-17,-1, حراره قاطعه كفايه شركه نت بتعذبني كمان مصريه اتصالات,,0,1
21-5-17,1, مؤسسه اهل مصر تنميه تعاون شركه مصريه اتصالات يطلقان ماراثون احتفالي تنظيم كايرو رانرز احتفال,,0,0
21-5-17,1, رئيس تنفيذي ل مصريه اتصالات يدعو عاملين تقديم افكار تدعم شركه احمد بحيري,,0,0
21-5-17,-1, مصريه اتصالات اليوم اليوم رقم بدون استجابه شركه لاصلاح عطل,,0,0
21-5-17,-1, عروض جديده مصريه اتصالات انترنت تليفون ارضي بمناسبه رمضان اخر انباء,,0,0
20-5-17,1, تابع مصريه اتصالات اكتوبر حي اول نكتفي قدر اليوم ونستكمل غدا عالعيار تقيل وهافضل وراهم لحد يتقوالله الله يرحم مصر,,0,0
20-5-17,1, تابع مصريه اتصالات اكتوبر اما موظفين ال فلا لسان ولا احسان ماشاالله واحد مفكر نفسه بيل جيتس ولا ولا كفايه شرره,,0,0
20-5-17,-1, تابع مصريه اتصالات يعني مصريين استفادوش حاجه بيع اتصالات ممكن حكومه استفادت شويه اكراميات وكده مالحكومه مصريين واو,,0,0
20-5-17,-1, دوري مصريه اتصالات خسرت اسماعيلي واتلغي ليهم جول فضيحه اكتر جول حسن شحاته اللي زمالكاويه قارفينا بيه دا لحد دلوقتي,,0,0
20-5-17,-1, اسماعيل يس خدمه عملاء مصريه اتصالات عام عبر,,0,0
20-5-17,1, مصريه اتصالات,,0,0
20-5-17,1, اثنين مايو مصريه اتصالات يفوز زمالك بثلاثه اهداف مقابل هدفين ستاد مقاولون اسبوع,,0,0
19-5-17,1, مصريه اتصالات,,0,0
19-5-17,1, بوابه اهرام استعلام فاتوره تليفون ارضي عبر موقع مصريه اتصالات اون لاين عبر نبض,,0,0
19-5-17,1, استعلام فاتوره تليفون ارضي عبر موقع مصريه اتصالات اون لاين,,0,2
18-5-17,1, اول بوست ليا بيت انقطاع نت نص بسبب مصريه اتصالات شكرا استجابه ونص,,0,0
18-5-17,-1, نت مجاش الحد هروح امسك كسم بتوع مصريه اتصالات والله,,0,0
17-5-17,1, اموال غد برايم تحدد قيمه عادله ل مصريه اتصالات جنيه سهم,,0,0
17-5-17,-1, كسم مصريه اتصالات,,0,0
17-5-17,1, شركه مصريه اتصالات,,0,0
17-5-17,-1, انتم تمام كلمتوني امبارح نت رجع مشكله مصريه اتصالات,,0,1
17-5-17,1, فايده وحيده لتقديم طلب او زياره شركه مصريه اتصالات واي فاي ببلاش,,0,0
17-5-17,-1, مصريه اتصالات تبتز اهل مصر جريده مستمرون كشف فساد مزيد تفاصيل,,0,1
17-5-17,1, مليون جنيه ايرادات مصريه اتصالات فودافون شهور قاهره قالت شركه مصريه اتصالات,,0,0
17-5-17,-1, لسه صاحي نت جه اهه بس خليني سايب اسم نهارده عشان غدر مصريه اتصالات,,0,1
17-5-17,1, متاح الان بوم احمد سليمان خيال ماته خليها كول تونك لعملاء مصريه اتصالات خيال مااته رساله,,0,0
16-5-17,-1, ريفيو مفروض اعمل فيديو صغير بس مصريه اتصالات راي اخر,,0,0
16-5-17,1, بس حسبي الله ونعم وكيل مصريه اتصالات,,0,0
16-5-17,-1, ازهر هيطلع فتوي يحلل سباب مصريه اتصالات تي داتا,,0,0
16-5-17,-1, مباشر تداول مصريه اتصالات يرتفع انضمام لمؤشر اسواق ناشئه,,0,0
16-5-17,1, استعلام فاتوره تليفون ارضي مصريه اتصالات معرفه فاتوره تليفون ارضي وطريقه,,0,0
16-5-17,-1, مصريه اتصالات يرتفع انضمام لمؤشر اسواق ناشئه,,0,0
16-5-17,1, مورجان ستانلي اضافه سهم مصريه اتصالات لمؤشر ام اس سي اي مصر اسهم صغيره,,1,0
16-5-17,1, مليار جنيه ايرادات مصريه اتصالات ربع اول اعلنت شركه مصريه اتصالات نتائج,,0,0
16-5-17,1, مصريه اتصالات تي ايداتا انتا هتشم ريحه جنه ليه منخيري بايظه,,0,0
15-5-17,1, استعلام فاتوره تليفون ارضي لشركه مصريه اتصالات لجميع محافظات,,0,0
15-5-17,1, ٤ ٢ مليار جنيه ايرادات مصريه اتصالات ٣ اشهر,,0,0
15-5-17,1, مصريه اتصالات نموا ايرادات ربع اول عام جاري شروق,,0,0
15-5-17,1, عالم اليوم مصريه اتصالات تربح مليار جنيه ربع اول لعام,,0,0
15-5-17,1, تعويم يقفز بعائدات مصريه اتصالات دولي كابلات بحريه مصر اقتصاد,,0,0
15-5-17,1, مصريه اتصالات اجمالي نمو ايرادات شركه بلغ مصريه اتصالات اجمالي نمو ايرادات شركه,,0,0
15-5-17,1, مصريه اتصالات تحقق مليار جنيه ارباحًا اشهر,,0,0
15-5-17,-1, كسم مصريه اتصالات مدام اللي قاعده سنترال موظفين كول سنتر كسم مصر اللي نتعتكم ولاد مومس,,0,0
15-5-17,1, معرفه فاتوره تليفون ارضي رقم فقط لشهر مايو موقع مصريه اتصالات,,0,0
15-5-17,1, تعويم يقفز بعائدات مصريه اتصالات دولي كابلات بحريه جريده مال,,0,0
15-5-17,1, اطار تحول مصريه اتصالات مشغل اتصالات متكامل سيتم تعديل ترقيم خطوط ارضيه محافظه دقهليه ليبدا,,0,0
15-5-17,1, موقع عيون شعب مهندس احمد بحيري رئيس تنفيذي شركه مصريه اتصالات مسيره مشرفه وتاريخ حافل في,,0,0
15-5-17,1, مصريه اتصالات ياخبر مليار جنيه صافي ارباح ربع اول اعتمد مجلس اداره شركه مصريه,,0,0
15-5-17,1, معرفه فاتوره تليفون ارضي رقم فقط لشهر مايو موقع مصريه اتصالات,,0,0
15-5-17,-1, بابا راح مصريه اتصالات قالهم اشمعني جيرانا عندهم حراره راحوا فصلوا تليفون جيرانا,,0,1
15-5-17,1, مباشر تداول نمو ايرادات يصعد بارباح مصريه اتصالات ربع اول,,0,0
15-5-17,1, استعلام فاتوره تليفون ارضي مصريه اتصالات معرفه فاتوره تليفون ارضي وطريقه,,0,0
15-5-17,1, ارتفاع ارباح مصريه اتصالات مليار جنيه ربع اول جريده مال,,1,0
15-5-17,1, نموا ايرادات مصريه اتصالات ربع اول,,0,0
15-5-17,1, اعلان تدريب صيفي بشركه مصريه اتصالات,,0,0
15-5-17,1, مصريه اتصالات تحقق ارتفاعا بارباح ربع اول وترتفع بايراداتها ل مليار جنيه,,0,0
15-5-17,1, ارتفاع ارباح مصريه اتصالات ب مليار ربع اول,,3,3
15-5-17,1, مصريه اتصالات مليار جنيه اجمالي ايرادات ربع اول,,0,0
15-5-17,1, مصريه اتصالات تحقق ارتفاعا بارباح ربع اول وترتفع بايراداتها ل مليار جنيه,,0,0
15-5-17,1, اخبار تقنيه تكنولوجيا مصريه اتصالات تعلن نتائج اعمال ربع اول لعام,,0,0
15-5-17,1, مليار جنيه صافي ارباح مصريه اتصالات ربع اول بنمو جريده بورصه,,1,0
15-5-17,-1, تعويم يرفع عائدات مصريه اتصالات ل مليار جنيه اشهر,,0,0
15-5-17,1, نموًا ايرادات مصريه اتصالات ربع اول عام جاري,,0,4
15-5-17,1, اعلام مصر نموًا ايرادات مصريه اتصالات ربع اول عام جاري,,0,0
15-5-17,1, محققه نموا اجمالي ايرادات بلغ مصريه اتصالات تعلن نتائج اعمال ربع اول لعام,,0,0
15-5-17,1, مليار جنيه ارباح مصريه اتصالات اشهر,,0,0
15-5-17,1, مصريه اتصالات تحقق مليار جنيه صافي ارباح ربع اول ل,,0,2
15-5-17,1, عاجل مصريه اتصالات تحقق ارباحا قدرها مليار جنيه ربع اول,,9,3
15-5-17,1, عنوان مصريه اتصالات قرارات مجلس اداره شركه بجلسته منعقده بتاريخ اسم شركه,,0,0
14-5-17,1, فوز مصريه اتصالات اتحاد شرطه مباراه مثيره ب قسم ثاني,,0,1
14-5-17,1, مصريه اتصالات,,1,1
14-5-17,1, قسم ثاني مجموعه ثانيه جوله دقيقه شادي عادل يتعادل ل مصريه اتصالات,,0,0
14-5-17,1, مصريه اتصالات توقع مذكره تفاهم شركه اورانج,,0,0
14-5-17,-1, حسام وابراهيم عندهم اقتناع حكام عايزين يخسروا فرق اللي بيدربوها حتي ايام بيدربوا مصريه اتصالات,,0,0
13-5-17,1, حوار اعطال مصريه اتصالات,,0,0
13-5-17,1, استعلام فاتوره تليفون ارضي مصريه اتصالات معرفه فاتوره تليفون,,0,0
13-5-17,1, اووه اووه انجازات مصريه اتصالات,,0,1
13-5-17,1, رزق بورسعيد بشتغل شركه مصريه اتصالات ببورسعيد,,0,1
13-5-17,1, مصريه اتصالات غيروا رقم ارضي اساسه انتو غيرتوه بس مافعلوش رقم لسه جيت ادفع اشتراك اتدفع خط جديد قديم,,0,0
13-5-17,1, ترجعولي نت خليكوا احسن مصريه اتصالات,,0,0
13-5-17,-1, بسبب مصريه اتصالات بس هاخد سناني تعويض اتصلنا بيهم بنقوله عندنا مشكله حراره قالنا طيب,,0,0
13-5-17,1, حاسس نفسي موظف مصريه اتصالات مثلا,,0,0
13-5-17,1, شركه مصريه اتصالات متعيين الف واخده فيهاكوته حبايب وبتوع مجلس شعب ارفدي كلاب دول وانتي بترفعي بزازه شعب,,0,0
12-5-17,-1, شركه مصريه اتصالات فاشله اسف,,0,1
12-5-17,1, تشيلسي دي مورينيو دروجبا لامبارد تيري كانت هتبقي مصريه اتصالات,,0,0
12-5-17,1, رابط استعلام فاتوره تليفون ارضي وسداد فاتوره مايو موقع شركه مصريه اتصالات,,0,0
12-5-17,1, استعلام فاتوره تليفون ارضي مصريه اتصالات معرفه فاتوره تليفون ارضي وطريقه,,1,1
12-5-17,-1, قصه شركه اورنج مصريه اتصالات اسرائيل وقضيه تخابر يهود ونقل مكالمات دوله يهود ولماذا تتخذ مصر قرار حازم اتجاهها,,0,0
12-5-17,1, شركه مصريه اتصالات,,0,0
12-5-17,1, كايروكي زمان اعلان مصريه اتصالات,,0,1
11-5-17,1, قطاع اتصالات يبرز ملتقي ثالث مصريه اتصالات تستعرض دورها بارز مسئوليه مجتمعيه وسيسكو تست,,0,0
11-5-17,1, وظائف شركه مصريه اتصالات ونقل بيانات اضغط تقديم شير خير,,0,0
11-5-17,1, انتداب خبير لفض نزاع اتصالات و مصريه اتصالات,,0,0
11-5-17,1, انتداب خبير لفض نزاع اتصالات و مصريه اتصالات,,0,0
11-5-17,1, معرفه فاتوره تليفون ارضي لشهر مايو وسدادها مجانا مصريه اتصالات,,0,0
11-5-17,-1, زعل شركه مصريه اتصالات وسطه ومحسوبيه وكله بيجامل كله حسابنا مدير سنترال منياالقمح بيجامل مهندسينه,,0,1
11-5-17,1, قطاع اتصالات يبرز ملتقي ثالث مصريه اتصالات تستعرض دورها بارز مسئوليه مجتمعيه وسيسكو تست,,0,0
11-5-17,1, اثنين مايو اسماعيلي يفوز مصريه اتصالات بهدف نظيف لقاء اسبوع تاسع عشرين دوري و,,0,0
11-5-17,1, غدا انطلاق رياضات موحده اولمبياد خاص موظفي مصريه اتصالات,,0,0
11-5-17,1, دستور انفراد ننشر قرارات اجتماع مصريه اتصالات,,0,0
10-5-17,1, حارس ثاني لمنتخب سويس يرتدي تيشيرت حراس نادي اهلي اثناء مباراه فريقه مصريه اتصالات,,22,111
10-5-17,-1, مصريه اتصالات كانت كسبت انهارده كانت هتفرق كروت شحن هه,,0,0
10-5-17,1, ترتيب مجموعه ثانيه ب قسم ثاني جوله صعود نصر دوري ممتاز هبوط شهداء مصريه اتصالات قسم ثالث,,0,1
10-5-17,-1, نهايه مباراه تعادل سلبي فريقين منتخب سويس مصريه اتصالات دوري,,0,25
10-5-17,1, احمد فراويله لاعب مصريه اتصالات يهدر ركله جزاء وفرصه تقدم لفريقه منتخب سويس مصريه اتصالات دوري,,0,21
10-5-17,1, مباراه دوري قسم تاني هتتلعب شويه منتخب سويس مصريه اتصالات ماتش بيحدد هبوط اهم في,,0,0
10-5-17,1, شركه مصريه اتصالات,,0,0
10-5-17,1, هما مصريه اتصالات ومنتخب سويس بقو بيلعبو شامبيونز ليج امتي,,0,0
10-5-17,1, بتفرج ماتش منتخب سويس مصريه اتصالات حاجه قمه متعه,,0,0
10-5-17,1, ده مصريه اتصالات هبطوا درجه تالته كمان واضح شركه قررت تفكس كوره عقبال باقي شركات شاء الله,,2,2
10-5-17,1, تريكه تريكه هدف ابوتريكه رائع مرمي اتصالات موسم اهلي مصريه اتصالات,,39,70
10-5-17,1, اعلان شركه مصريه اتصالات مهندسين ومحاسبين ومندوبين ووظائف اخري تقديم عبر انترنت,,0,0
10-5-17,1, حسام حسن عذبتني معاك خليتني اشجع مصريه اتصالات مصري اتحاد اسماعيلي زمالك اردن يا رب يجي اليوم اللي اشجع اهلي,,0,1
10-5-17,-1, رئيس حاجه فنيه مصريه اتصالات كتبلي ورقه لموظف مكتوب نصا مطلوب ازهار رقم حسابيا,,0,0
9-5-17,1, احصائيات ارقام قسم ثاني مصريه اتصالات هابط رقم قسم ثالث يتبقي فرق اخري تستطيع تتوقعهم,,0,0
9-5-17,1, سداد فاتوره تليفون موقع مصريه اتصالات مايو,,0,0
9-5-17,1, سؤال الي رئيس برلمان والي رئيس وزراء شركه مصريه اتصالات خاضعه لقانون خدمه مدنيه سيطبق,,0,0
9-5-17,-1, فساد مصريه اتصالات ديه حقيقه حصلت معايا مقدم تليفون لمده سنه اما جالي خط ادوه لحد تاني,,0,0
9-5-17,-1, لاقيت اوسخ تي داتا مصريه اتصالات,,0,0
9-5-17,1, مصريه اتصالات تقدم كشف حساب مسئوليه مجتمعيه ملتقي سنوي ثالث ل,,0,0
9-5-17,1, استعلام فاتوره تليفون ارضي مصريه اتصالات معرفه فاتوره تليفون ارضي وطريقه,,0,0
9-5-17,1, مقدم خط ارضي مصريه اتصالات بقالي شهرين ولا حياه لمن تنادي عاش مصر,,0,0
9-5-17,1, مصريه اتصالات تدشين برج محمول استعداد لتقديم خدمات موبايل,,0,1
9-5-17,1, مصريه اتصالات هواحنا هنخلص اما اشوف اخرتها معاكو,,0,0
8-5-17,-1, مصريه اتصالات انشاء شبكه جيل رابع صيف,,1,1
8-5-17,1, فاتوره تليفون ارضي عبر موقع مصريه اتصالات زعيم توتيرفلولورز رايق,,0,0
8-5-17,1, استعلام فاتوره تليفون ارضي مصريه اتصالات,,0,0
8-5-17,1, مصريه اتصالات احلال كابلات فايبر سنوات و برج محمول قريبا قال مهندس رفعت جنيدي مدير,,0,0
8-5-17,-1, مصدر مصريه اتصالات تبدا تجارب تشغيل خدمات جيل رابع محمول رمضان,,0,0
8-5-17,1, جنيدي مصريه اتصالات شاركت حمله مصر خاليه فيروس سي جريده بورصه,,0,0
8-5-17,-1, اقتصاد مصريه اتصالات تعلن موعد انشاء شبكه جيل رابع,,0,0
8-5-17,1, رفعت جنيدي نائب رئيس تنفيذي لشؤن مناطق موارد بشريهالمصريه اتصالات مواطن عندما تقع عاتقه مسئوليه كبيره تدفعه نجاح,,0,0
8-5-17,1, شركه وقتي دفع تحصيل الكتروني تقدم خدمات اورانج اتصالات فودافون مصريه اتصالات تي داتا دفع,,0,0
8-5-17,1, الي وزير اتصالات اقول فصل هيئه مصريه اتصالات شركه مسماه تي اي داتا,,0,3
8-5-17,-1, تثبت مصريه اتصالات تملك اسوا موظفين وخدمه عملاء وخصوصا سنترال رحاب,,0,0
7-5-17,1, مصر فايف تفصيل تعرف طريقه استعلام فاتوره تليفون ارضي عبر موقع مصريه اتصالات,,0,0
7-5-17,1, اطار تحول مصريه اتصالات مشغل اتصالات متكامل سيتم تعديل ترقيم خطوط ارضيه محافظه دقهليه ليبدا,,0,0
7-5-17,1, فاتوره تليفون ارضي موقع رسمي شركه مصريه اتصالات,,0,0
7-5-17,1, استعلام فاتوره تليفون ارضي مصريه اتصالات معرفه فاتوره تليفون,,0,0
7-5-17,1, اعلان شركه مصريه اتصالات مهندسين ومحاسبين ومندوبين ووظائف اخري تقديم عبر انترنت اعلان وظائف وزاره,,0,0
7-5-17,-1, كسم سمولينج والله ميلعبش مصريه اتصالات فراويله,,0,1
7-5-17,1, اسالوا موظفين شركه مصريه اتصالات عارفين قذارته زمان,,0,0
7-5-17,1, فاتوره تليفون فاتوره تليفون ارضي منزلي لشهر ابريل موقع مصريه اتصالات,,0,0
7-5-17,-1, مصريه اتصالات عبروا ناس ردوا عليهم,,0,0
7-5-17,1, فاتوره تليفون ارضي الان طريقه استعلام سداد موقع مصريه اتصالات الكتروني,,0,0
7-5-17,1, اخر موعد لسداد فاتوره تليفون ارضي ابريل دفع غرامه جنيهات عبر موقع مصريه اتصالات,,0,0
7-5-17,1, اعرف فاتوره تليفون ارضي الان وطريقه سداد عبر موقع شركه مصريه اتصالات,,0,0
7-5-17,1, اعرف فاتوره تليفون ارضي الان وطريقه سداد عبر موقع شركه مصريه اتصالات,,0,0
7-5-17,1, تعرف استعلام فاتوره تليفون ارضي مصريه اتصالات طريقه سداد فاتوره تليفون ارضي كترونيًا,,0,0
7-5-17,1, اخبار عربيه خطوات استعلام فاتوره هاتف ارضي لشهر مايو مصريه اتصالات,,0,0
7-5-17,1, تفصيل طريقه استعلام فاتوره تليفون ارضي لشهر مايو مصريه اتصالات,,0,0
6-5-17,1, وظائف شركه مصريه اتصالات ونقل بيانات لمختلف تخصصات جنسين تقديم انترنت,,0,0
6-5-17,1, اللي مفروض يتحاسب انخفاض قيمه سهم مصريه اتصالاتالعاملين اللي بيكتبوا فيس بوك مع اللي,,0,0
6-5-17,1, مفروض هندرب مصريه اتصالات يعني اتصلوا بيا هاجي احصل فواتير تيليفون عندكوا,,0,0
6-5-17,1, ترتيب جوله مجموعه ثانيه قاهره قناه ب قسم ثاني صعود نصر دوري ممتاز هبوط شهداء مصريه اتصالات,,0,0
6-5-17,1, مصريه اتصالات تعلن نتائجها ماليه مايو,,0,0
6-5-17,1, سهم مصريه اتصالات يختبر جنيهات مجددًا,,0,0
6-5-17,-1, مصريه اتصالات تسجن ٩٦ تايوانيا وصينيا وتغرمهم ١٩ مليونا,,0,0
6-5-17,-1, نفس تليفون اللي كانت بتركبه مصريه اتصالات,,0,1
6-5-17,1, انتم عايزين اتعامل سنترال واغير خط تليفون حسابي وده هيحصل مالي مشكلتكم مصريه اتصالات حلوها,,1,0
5-5-17,1, اطار تحول مصريه اتصالات مشغل اتصالات متكامل سيتم تعديل ترقيم خطوط ارضيه محافظه دقهليه ليبدا,,0,0
5-5-17,1, تي ايه داتا بوسي كات مصريه اتصالات دعوه نفسك تتحقق صاحب تويتر وفلورز جممعه رجاء مصر,,1,2
