Date Time,Sentiment,Text,User Name,Retweets,Favorites
8-10-17,1, ياعم مصريه اتصالات مصريه اتصالات استاد كله مفيهوش تيليكوم ايجيبت,,0,0
8-10-17,1, مفروض اللي هيكون طبيعي دوري جوله جايه عشان مصريه اتصالات اخدت رعايه دوري حتي تصوير هيبقي كده وشركه برتغاليه اللي هتصور,,0,0
8-10-17,1, اعلان مصريه اتصالات شركه ناجحه بدرجه امتياز فشل جامد جدا تجشيع عيال بتوع ساحل او او وكده بتوع شبين,,0,0
8-10-17,1, شبين اتقالت فاعلان مصريه اتصالات يجدعان منوفيه هتفضل حراقه لامتي,,0,5
8-10-17,-1, اعلان مصريه اتصالات حلو كدا ازاي بتوع ساحل اوه اوه بتوع شبين,,1,2
8-10-17,1, مصريه اتصالات مانسيتش شبين اعلانها برده مصر,,0,0
8-10-17,-1, مصريه اتصالات قلبوا استاد بنفسجي هبكرّهوني لون ولا ايه,,0,0
8-10-17,1, راعي رسمي مصريه اتصالات,,0,0
8-10-17,1, اعجبني فيديو مصريه اتصالات تطلق خطوط فائقه,,1,0
8-10-17,1, نجم مباراه لحد دلوقتي شعار مصريه اتصالات اللي عامله طفل مبربر ببرنامج رسام قدر يفرض ايقاعه عالماتش,,0,0
8-10-17,-1, يلعن ابو قرف اللي عملته مصريه اتصالات استاد,,0,0
8-10-17,1, بنفسجي اللي حولين ملعب بتاع مصريه اتصالات مفرحني والله انا متفائله,,0,0
8-10-17,1, برج عرب واضح مصريه اتصالات دافعه جامد,,0,0
8-10-17,-1, مصريه اتصالات راعي رسمي احتكار مصري برعايه كلاب دوله,,0,0
8-10-17,1, مصريه اتصالات عاجبها ناس مهندسين ساحل بتتريق تشجعهم تركان بلطجه وشوفو هيشتري خطكم يارب انصر مصر,,0,0
8-10-17,1, تشجيع ثالثه يمين شياطين قذف جبهه دي ولا مصريه اتصالات,,0,0
8-10-17,1, تشجيعه مصريه اتصالات اقفل ماتش وافتحه,,0,0
8-10-17,1, اعلان مصريه اتصالات يفرح جدا يعني,,1,2
8-10-17,1, حلو جو مصريه اتصالات لون موف,,0,0
8-10-17,1, مصريه اتصالات وشبكه منتظر تطمنوني وتسبتولي فعلا رزق عافيه نجاح عافيه كفاءه,,0,0
8-10-17,-1, اعلان بتاع مصريه اتصالات اللي بيقولك احلي حاجه مصر اهلها كداب فشخ,,0,0
8-10-17,1, مصريه اتصالات عامله اعلان بتقول شكرا غانا عملتي اللي عليكي ربنا يحكمنا ولايا,,0,0
8-10-17,1, اعلان مصريه اتصالات راعي منتخب مصري,,0,0
8-10-17,-1, اعلان مصريه اتصالات بتاع ابله وداد متخلف فشخ,,0,0
8-10-17,1, اعلان مصريه اتصالات حلو اوي,,0,2
8-10-17,1, تمنيت ال يتبع مصريه اتصالات اني تمنيت ال تتبع شعب دوله حراميه,,0,1
8-10-17,1, مصريه اتصالات عاملالنا عرض شايله عننا ارضي نت بجد شركات كلها زي ال والله عظيم,,0,1
8-10-17,1, مصريه اتصالات برعايه غاده ابراهيم هاند ميد غامق عشان احداث,,0,0
8-10-17,1, حاجه وحيده اللي حبتها مصريه اتصالات لون لوجو موف بحب لون جدا شكله حلو اوي استاد,,0,1
8-10-17,-1, لون ابنلوسخه اللي مصريه اتصالات عاملين بيه تراك عينيا وجعتني,,0,1
8-10-17,1, حلو لون الي مصريه اتصالات عملاه حوالين ملعب,,0,1
8-10-17,-1, بس مصريه اتصالات صارفه ومكلفين عالاخر وتراك ملعب كله بنفسجي وحاجه اخر شياكه,,2,9
8-10-17,1, مصر فايف رابط وخطوات استعلام فاتوره تليفون ارضي اكتوبر عبر شركه مصريه اتصالات,,0,0
8-10-17,1, اعلان مصريه اتصالات بتاع منتخب حلو فشخ,,1,0
8-10-17,1, عاجل اخبار مصر اليوم طريقه تقدم ل وظائف مصريه اتصالات جديده شركه عبر موقع رسمي,,0,0
8-10-17,1, كيفيه اشتراك خدمه حسابي جديده مقدمه شركه مصريه اتصالات استعلام فواتير تليفون ارضي جديده,,0,0
8-10-17,1, مصريه اتصالات تدري والله قلبت استاد برج عرب لاعلان ل,,2,0
8-10-17,1, فواتير تليفون منزلي اكتوبر استعلم فاتوره تليفون ارضي اكتوبر عبر رابط مصريه اتصالات جديد,,0,0
8-10-17,1, مصريه اتصالات تختار قنوات و بيرمدز موزعين معتمدين سوق مصريه,,0,0
8-10-17,1, مصريه اتصالات,,0,1
8-10-17,-1, عاجل اخبار مصر اليوم اماكن وطريقه حجز خطوط شبكه محمول تتبع شركه مصريه اتصالات,,0,0
8-10-17,1, عشان مصر تفضل تتمرط عشان شويه ورق اسبوعين وف اخر تيجي موظفه ملهاش لازمه توقف حاجه واخبطي دماغك حيطه شكرا مصريه اتصالات شكرا مصر حسبي الله,,0,1
8-10-17,-1, اتصالات شركه متخلفه ونظامها متخلف ولما اخلص رصيد هكسر خط واجيب خط مصريه اتصالات مفروض سيستم معمول يخدمني ولا يعصبني,,0,2
8-10-17,1, تمام مصريه اتصالات راعي رسمي الان دوري ممتاز اصبح اسمه دوري مصريه اتصالات,,0,2
8-10-17,-1, مصريه اتصالات راعي رسمي كره مصريه منتخب مصر زمالك ثلاث سنوات,,0,1
8-10-17,1, بعت ڤيديو قراءه قران ستاد برج عرب لاختي اللي بتشتغل مصريه اتصالات,,0,0
8-10-17,1, تابعوا صفحه مصريه اتصالات استفسار خط ارضي موبايل انترنت منزلي مكان واحد,,0,0
8-10-17,-1, فروع بيع مصريه اتصالات مصر كلها مصريه اتصالات احنا منك,,0,0
8-10-17,1, بنشجع مصر مصريه اتصالات راعي رسمي لمنتخب مصر مع بعض نقدر فخور بكوني جزء من هذا كيان,,0,0
8-10-17,1, فا استعلام فاتوره تليفون ارضي لشهر اكتوبر موعد سداد وطرق دفع لدي شركه مصريه اتصالات بسهوله,,0,0
8-10-17,-1, مجرد اخلص حوار مصريه اتصالات عرص دا هيبدا اليوم افضل,,0,0
8-10-17,-1, عايز تشوف تفاهه شعب شوفوا وهو بيروح ٧ صبح واقف طابور لحد اخر نهار يشتري خط لشركه فاشله اسمها مصريه اتصالات,,0,1
8-10-17,1, اليوم انطلاق اسبوع جيتكس اتصالات وتكنولوجيا معلومات بدبي مصريه نيوز,,0,0
8-10-17,1, و مصريه اتصالات,,0,0
8-10-17,1, الله يحرق كسم مصريه اتصالات اللي عايز يقدم خطوط ارضي صباح خير,,0,1
8-10-17,1, مصريه اتصالات راعي منتخب فودافون متقاطعش اتصالات بتشكر غانا كوكارجعت اغنيه تشكيل بيبسي عين جهينه مبروك جدعان,,0,1
8-10-17,-1, شعار احنا منك مصريه اتصالات راعي رسمي كره مصريه لمده مواسم متتاليه,,0,0
8-10-17,-1, توزيع اعلان زباله بس اظن هيتحط شعار شبكه رابعه كلمه مصريه اتصالات,,0,1
8-10-17,1, فاتوره تليفون ارضي مصريه اتصالات لشهر اكتوبر معرفه فاتوره,,0,0
8-10-17,1, جاي برج عرب غدا لتشجيع منتخب مصر شكرا لاتحاد كوره مصريه دعوه شركه راعيه مصريه اتصالات,,0,0
8-10-17,1, اللي بتقولوه رقم موحد شركه مصريه اتصالات خط ارضي او محمول ااشركه مصريه اتصالات تملك,,0,0
8-10-17,1, اعلان مصريه اتصالات ٢٠١٧ اُغنيه شبكه,,0,0
8-10-17,1, رابط استعلام فاتوره تليفون ارضي مصريه اتصالات وطريقه سداد عبر خدمه فوري,,0,0
7-10-17,-1, مصريه اتصالات بتاعه ارضي اشترت تي داتا بقالها اربع سنين مثلا عملت موبايل شهرين حضرتك اصلا تي داتا خره زمان,,0,0
7-10-17,1, صفحه دي تمثل مصريه اتصالات رجاء تصدقوها,,0,0
7-10-17,-1, نجيب ساويروس يحذر كارثه ستحدث مصريه اتصالات ويطالب عدم فعلها هواء,,0,0
7-10-17,1, وظائف مصريه اتصالات موقع الكتروني لطلب عمل مصريه اتصالات وخطوات تقديم عمل,,0,0
7-10-17,1, مصريه اتصالات عامله اغنيه فشيخه,,0,1
7-10-17,1, منشن لصاحبك اللي اشتري خط مصريه اتصالات جديد عايز اعرف شعوره دلوقتي,,0,0
7-10-17,-1, راي تيوب اخر عروض شبكه مصريه اتصالات تحويل يها بنفس رقم ا,,0,0
7-10-17,1, حلم مليون بنفسجي استاد برج عرب يتزين عرس كروي فرحه كبيره رعايه راعي جديد كره مصريه مصريه ل تصالات,,11,12
7-10-17,1, واقف مصريه اتصالات عادي فاذا بعميله عادي برده وموظف عادي برده هوب واد غمضه عين ثبت بنت عايز يعلمني افتح مواضيع زيه,,0,2
7-10-17,1, فنكوش جديد بتاع مصريه اتصالات ابتدي ولا لسه,,0,2
7-10-17,1, ملها مصريه اتصالات نقصد تي داتا,,0,1
7-10-17,1, اسم دوري مصري مواسم ثلاثه مقبله دوري مصريه اتصالات,,0,0
7-10-17,-1, ناس واقفه مصريه اتصالات عشان تشتري خطوط جديده ولا كانها فراخ جمعيه ثمانينات,,0,1
7-10-17,1, مصريه اتصالات تطلق خطوط فائقه سرعه وباسعار منخفضه,,0,0
7-10-17,1, مصريه اتصالات تطلق خطوط فائقه سرعه,,0,0
7-10-17,-1, هنعمل مستحيل علشان نخلي مصريه اتصالات شبكه اولي مصر,,13,2
7-10-17,1, قائمه اكواد مصريه اتصالات يبدا كود شبكه تليكوم شبكه رابعه محمول كود ويمكن شراء خطوط,,0,0
7-10-17,-1, مصريه اتصالات ماساه اداره ولا متابعه ولا خدمه عملاء ولا علاقه عالم معاصر دي كانت هيئه مواصلات واسوا كمان,,6,12
7-10-17,-1, يوجد صفحه فيسبوك تنتحل صفحه مصريه اتصالات وتنصب ناس تقوللهم شيروا واعملوا لايك عشان تكسبوا,,0,0
7-10-17,1, مصريه اتصالات يفترض انها شركه تمتلك حكومه حصه تقدر ب بس بصراحه تكيه ومش تكيه موظفين اصلا بيكرهوا شركه يتبع,,6,5
7-10-17,-1, نهارده سنترال مقطم يعني مصريه اتصالات لولا قليل حكمه زماني نيابه بتهمه اعتداء موظف وازدراء اديان يتبع,,5,6
7-10-17,1, اكواد عروض شبكه مصريه اتصالات جديده مميزات خط جديد,,1,0
7-10-17,-1, نهارده حصلت حاجه غريبه شركه مصريه اتصالات اتفاجئت خدمه نت قطعت قلت عادي اتصلت بفوري ادفع,,0,0
7-10-17,1, كيفيه اشتراك خدمه حسابي جديده مقدمه شركه مصريه اتصالات استعلام فواتير تليفون ارضي جديده,,0,0
7-10-17,1, وظائف مصريه اتصالات موقع الكتروني تسجيل عمل مصريه اتصالات وشروط تقديم عمل,,0,0
7-10-17,1, مشغل خط مصريه اتصالات اسبوع,,1,1
7-10-17,1, باستثناء اهلي دوري مصريه اتصالات بدلا دوري مصري,,0,4
7-10-17,1, كيفيه اشتراك خدمه حسابي جديده مقدمه شركه مصريه اتصالات استعلام فواتير تليفون ارضي جديده,,0,0
7-10-17,-1, مصريه اتصالات ترعي رسميًا مباريات كره قدم مصريه,,0,6
7-10-17,1, موظفه مصريه اتصالات لعميل انت فاكر اني,,0,0
7-10-17,1, بحب اعلان مصريه اتصالات اوي,,0,3
7-10-17,1, محدش يعرف تابع مصريه اتصالات,,0,0
7-10-17,1, مصريه اتصالات راعي مصري منتخب,,0,0
7-10-17,1, فواتير تليفون منزلي اكتوبر استعلم فاتوره تليفون ارضي اكتوبر عبر رابط مصريه اتصالات جديد,,0,0
7-10-17,1, ياجدعان خط جديد بتاع مصريه اتصالات ال هيبقي موجود معايا بليل ب ج عايز في خانكه اللي عايز يقول,,0,0
7-10-17,-1, مره تانيه توالي شركه مصريه اتصالات اوسخ شركه نت موجوده سمحتوا تشتركوش معاهم,,0,0
7-10-17,1, متشوفلنا وسطه مصريه اتصالات,,1,0
7-10-17,-1, مصريه اتصالات راعي رسمي كره مصريه لمده مواسم متتاليه,,0,0
7-10-17,1, او مصريه اتصالات تحط لوجو بشكل كبير ستكتب بخط صغير لوجو اسم اوبر يبقي اصغر شويه لان خلفيه خضرا حلوه,,0,0
7-10-17,1, اكتر حاجات اللي لفتت نظري وعجبتني موظفين مصريه اتصالات كلهم عاملين صورهم باسم شبكه جديده,,0,0
7-10-17,1, فواتير تليفون منزلي اكتوبر استعلم فاتوره تليفون ارضي اكتوبر عبر رابط مصريه اتصالات جديد,,0,1
7-10-17,1, الان خط مصريه اتصالات خط ساجعله خط اساسي لاستخدامي جيجا ب جنيه فعلا,,6,8
7-10-17,1, وظائف مصريه اتصالات موقع الكتروني تسجيل عمل مصريه اتصالات وشروط تقديم عمل,,0,1
7-10-17,-1, كفايه مصريه اتصالات اللي مكتوبه حاجه بت عرص,,0,0
7-10-17,-1, شكوي بتاعتي عالتايملاين مصريه اتصالات طريق ال اتصلوا موبايلي وحلوا مشكله شكرا مصريه اتصالات,,2,2
7-10-17,1, خايفين ينزلو مكان لوجو مصريه اتصالات شويه,,0,0
7-10-17,1, الان ستاد برج عرب يتزين بالوان شعار راعي رسمي لنادي كرامه وطنيه منتخب مصر مصريه اتصالات زمالك بقيت زمالكاوي عشان,,2,3
7-10-17,-1, شعار احنا منك مصريه اتصالات راعي رسمي كره مصريه لمده مواسم متتاليه,,0,0
7-10-17,1, برج عرب يتزين بشعار الوان مصريه اتصالات,,0,0
7-10-17,1, واعلان مصريه اتصالات اللي تيشيرت ده ناقصه احمد جعفر وعرفه سيد عشان احس بشجع نادي مصريه اتصالات حق,,0,0
7-10-17,-1, اعلانات مصريه اتصالات ستظهر قمصان فرق دوري عدا واحدا مصراوي,,0,6
7-10-17,-1, روتين جمعه سبت خناقات مصريه اتصالات شركه بنت دين كلب خدمه عملاء اعطال حاجه بنت دين كلب فعلا يعني,,0,0
7-10-17,1, نجوم مصريه طريقه تقدم ل وظائف مصريه اتصالات جديده شركه عبر موقع رسمي,,0,0
7-10-17,1, مره اولي شعار مصريه اتصالات قمصان فرق دوري ممتاز,,0,0
7-10-17,-1, رعاه زمالك اسماء ومكان لوجوهات مصريه اتصالات منتصف صدر اوبو علي شمال,,0,0
7-10-17,1, وظائف مصريه اتصالات موقع الكتروني تسجيل عمل مصريه اتصالات وشروط تقديم عمل,,0,0
7-10-17,-1, انا مصريه اتصالات استعين بمرتضي منصور كوجه اعلاني حمله كبيره يطلع يهدد عملاء اما يحولوا لشبكه,,0,0
7-10-17,-1, اعلانات مصريه اتصالات ستظهر قمصان فرق دوري عدا واحد,,2,5
7-10-17,1, راعي رسمي نادي زمالك وعشان زمالك وهو كبير زمالك راعي دوري مصريه اتصالات زمالك وبس,,1,1
7-10-17,-1, عاجل مصريه اتصالات تعلن رسميا رعايتها كره مصريه لمده مواسم متتاليه صدي بلد بلد,,9,37
7-10-17,1, اعجبني فيديو مصريه اتصالات تطلق خطوط فائقه,,0,0
7-10-17,1, لعبه مصريه اتصالات بص يابني ودور واحد بتاع اقتصاد يشرحهالك مصريه اتصالات معملتش,,0,0
7-10-17,1, اغنيه منك اعلان مصريه اتصالات,,0,0
7-10-17,-1, تبادل حديث قريب ليه وهو موظفي مصريه اتصالات قاللي كلام ده جيش ملوش نسبه مصريه,,0,0
7-10-17,1, تشجيع تالته يمين غير شياطين مصريه اتصالات راعي مصري منتخب مصري بنشجع مصر مع,,0,1
7-10-17,1, بنشجع مصر شجع منتخبنا وطني اكسب مصريه اتصالات,,0,0
7-10-17,-1, برج عرب لون بنفسجي رعايه مصريه اتصالات كره مصريه,,9,48
7-10-17,-1, يعني دلوقتي مصريه اتصالات راعي دوري وفي نفس وقت راعي زمالكتخيل بقي فودافون هي راعي دوري وراعي اهلي,,0,0
7-10-17,1, لعبه مصريه اتصالات بص يابني ودور واحد بتاع اقتصاد يشرحهالك مصريه اتصالات معملتش,,0,1
7-10-17,1, مصريه اتصالات الي محكمه,,0,0
7-10-17,1, راعي جديد لاتحاد كره مصريه اتصالات طلب تراك ستاد برج عرب يتلون بنفسجي,,0,0
7-10-17,-1, طب كتبوا بس تيشيرت الله هتبقي اشيك كلمه مصريه اتصالات ابن وسخه اللي بيختار تصميمات,,1,1
7-10-17,1, اعاده تشكيلها جديد رغم اكتفاء سوق بثلاث شبكات عملاقه اطلقت شركه مصريه اتصالات شبكه محمول رابعه,,1,1
7-10-17,1, تفاصيل انظمه خط كارت شبكه محمول مصريه اتصالات,,0,0
7-10-17,1, شكرا انكم قطعتوا خدمه خط بتاعي وشجعتوني اني اشتري خط مصريه اتصالات احسن بكتير,,0,0
7-10-17,1, اعلان مصريه اتصالات ٢٠١٧ اُغنيه شبكه,,0,1
7-10-17,1, بمناسبه نصر اكتوبر وبعد معاناه اخويا ست ساععات بصوت سادات دهاليز مركز خدمه عملا مصريه اتصالات,,1,1
7-10-17,-1, نجوم مصريه اخر عروض شبكه مصريه اتصالات تحويل يها بنفس رقم موقع الكتروني عبر نبض,,0,0
7-10-17,1, اهم موضوع سبع رعاه تيشرت وشورت زمالك اللي راعي رئيسي اللي صدر تيشرت مصريه اتصالات حيقدمه زمالك,,0,0
7-10-17,-1, رعاه زمالك اسماء ومكان لوجوهات مصريه اتصالات منتصف صدر اوبو علي شمال صدر خطين,,27,168
7-10-17,1, اعجبني فيديو مصريه اتصالات تطلق خطوط فائقه,,0,0
7-10-17,1, مصريه اتصالات وشكلنا قلبنا تيشيرت سنترال,,0,0
7-10-17,1, جدا والله انتظار خطوط جديد بتاع مصريه اتصالات وبعد هغير خط,,1,1
6-10-17,1, تيم مملكه وفولورز اكتوبر مصريه اتصالات انا رايح اغير شريحه حالا,,5,0
6-10-17,1, بقي مصريه اتصالات,,0,0
6-10-17,1, عاجبني اداء مصريه اتصالات صراحه,,1,0
6-10-17,1, عجبني اوي اعلان مصريه اتصالات ك كلمات ولحن وكل حاجه,,0,0
6-10-17,1, سنه وانتوا طيبين شاء الله سنه جايه عملاءكم حولوا علی مصريه اتصالات,,0,1
6-10-17,-1, مصريه اتصالات تتعهد بدعم منتخب حال تاهل مونديال صور مصر,,0,0
6-10-17,-1, ياعم والله انتو نكدتو علينا منظر فانله بقي ملوش لون كفايه يتكتب مصريه اتصالات تبقي ضهر بس,,0,0
6-10-17,1, فعلا رايي يحطو مصريه اتصالات وخلاص,,0,1
6-10-17,1, بشكر بعيش اسوء تجربه معاهم ومع مصريه اتصالات,,1,1
6-10-17,1, اشياء معرفتها شراء خط جديد مصريه اتصالات شبكه رابعه جديده,,0,0
6-10-17,1, مصريه اتصالات تحكم,,0,0
6-10-17,1, خط بارليف فودافون ولا مصريه اتصالات,,0,0
6-10-17,1, واضح اوستاظ عمرو موسي كاتب تويته جابتله كلام واضح مصريه اتصالات عامله اعلان مستفز,,1,1
6-10-17,1, فا استعلام فاتوره تليفون ارضي لشهر اكتوبر موعد سداد وطرق دفع لدي شركه مصريه اتصالات بسهوله,,0,0
6-10-17,1, مصريه اتصالات تطرح مسابقه لكسب تذاكر مباراه منتخب مصر كونغو,,0,0
6-10-17,1, دلوقتي فرصه تكسب مصريه اتصالات تذاكر مباراه مصر كونغو عشان تروح تشجع منتخبنا استاد برج,,0,0
6-10-17,1, مفروض بتعمل اعلان لشركه محمول جديده اسمها يبقي تنشره وسط ناس تكتب تي شيرت طبيعي تكتب مصريه اتصالات,,0,1
6-10-17,1, اذا كانت مصريه اتصالات اشترت دوري وعاوزه تشفره عاوزاهم يذيعوا حفله هوا مباشره دلوقتي كله بفلوس ولينا رب اسمه كريم,,0,0
6-10-17,1, دا بصراحه اداره تسويق لشركه مصريه اتصالات لازم تتحاكم محاكمه عسكريه ليه لوجو مكتوب كدا مكتوب ليه عربي,,0,1
6-10-17,1, اعلان مصريه اتصالات اكبر شبكه اتصالات مصر اول مشغل اتصالات,,0,0
6-10-17,1, مصريه اتصالات خافو يحطو شعار جديد تيشيرت محدش يعرفه راحو كاتبين اسم شركه عربي,,0,2
6-10-17,-1, مصريه اتصالات وغلاء كروت شحن,,0,0
6-10-17,1, رعاه لبس زمالك لاكتيل سايب بنك مصريه اتصالات اضافه اللي شركه مصمم لتيشرت فريق,,0,0
6-10-17,1, فق يو مصريه اتصالات,,0,0
6-10-17,-1, شخص اللي فكر وضع اعلانات طريقه دي اعتقد انه عندهوش وجهه نظر اساسا مشكله كانت شركه شعار مصريه اتصالات,,0,0
6-10-17,1, ناوي اجيب خط مصريه اتصالات جديد بقت راعي زمالك خلاص بكره هشتريه,,0,4
6-10-17,-1, مكان لسه مصريه اتصالات نحط كمان راعي عشان نستغل مساحه كلها ونبقي نادي زمالك رعاه خرا ده والله,,0,2
6-10-17,-1, خرا كلمه مصريه اتصالات تقرف بجد شيرت بقي زباله وملوش ملامح,,0,0
6-10-17,1, دوري بقي اسمه دور مصريه اتصالات وكاس مصر اسمه كاس عبورلاند هتتحججوا ازاي دلوقتي بقي,,0,0
6-10-17,1, غالبا مصريه اتصالات راعي عام دوري متعاقدناش وي اللي شبكه اتصالات محمول,,0,0
6-10-17,-1, ليه بدل مصريه اتصالات,,0,0
6-10-17,1, تيشيرت جديد حلو نسبالي معنديش مشكله كلمه مصريه اتصالات,,0,0
6-10-17,1, كويس بس اعتراض وحيد عارف مصريه اتصالات نزلت شويه لتحت تشيرت هيبقي افضل ولا,,0,0
6-10-17,-1, اصبح زمالك ثلاث رعاه قميص فريق اول وهم مصريه اتصالات اوبو صدر قصراوي جروب كتف,,0,0
6-10-17,1, مصريه اتصالات بنقولها عندنا مشكله نت ويقولولنا رستر راوتر عشان نتعلم حياه مراحل ودي,,0,0
6-10-17,1, ظهور اول ل مصريه اتصالات راعي زمالك جديد قميص,,0,0
6-10-17,1, ديه اللي زعلانه انما مصريه اتصالات هيتحط لوجو ليها اكيد,,0,0
6-10-17,1, لاعبو زمالك يظهرون باعلان مصريه اتصالات امام طلائع,,0,0
6-10-17,1, تيشيرت زمالك ب اضافه اعلانات شعار مصريه اتصالات وشركه,,0,0
6-10-17,1, مصريه اتصالات,,0,0
6-10-17,1, ليه مصريه اتصالات مكتوبه عربي ليه,,0,0
6-10-17,1, تديها تديك سبعه مصريه اتصالات,,0,0
6-10-17,-1, ليه مصريه اتصالات وليه محطوطه وايه عشوائيه منظر,,10,116
6-10-17,-1, غالبا حاجه لونها ومفيش لوجو ساعات تبقي وساعات مصريه اتصالات وساعات,,1,2
